dc.contributor.author,dc.date.accessioned,dc.date.available,dc.date.issued,dc.identifier.uri,dc.relation.ispartofseries,dc.title,dc.identifier.other,dc.description.abstract,dc.format.extent,dc.format.mimetype,dc.language.iso,dc.subject
"Boyapati, Chandrasekhar; Liskov, Barbara H.; Shrira, Liuba",2023-03-29T15:36:02Z,2023-03-29T15:36:02Z,2002-07,https://hdl.handle.net/1721.1/149958,MIT-LCS-TR-858,Ownership Types and Safe Lazy Upgrades in Object-Oriented Databases,,,,,,
"Gassend, Blaise; Suh, G. Edward; Clarke, Dwaine; van Dijk, Marten; Devadas, Srinivas",2023-03-29T15:36:00Z,2023-03-29T15:36:00Z,2002-07,https://hdl.handle.net/1721.1/149957,MIT-LCS-TR-857,Caches and Merkle Trees for Efficient Memory Authentication,,,,,,
"Kaynar, Dilsun Kirh; Chefter, Anna; Dean, Laura; Garland, Stephen J.; Lynch, Nancy A.; Ne Win, Toh; Ramírez-Robredo, Antonio",2023-03-29T15:35:31Z,2023-03-29T15:35:31Z,2002-07,https://hdl.handle.net/1721.1/149945,MIT-LCS-TR-843,The IOA Simulator,,,,,,
"Taylor, Michael Bedford; Lee, Walter; Amarasinghe, Saman; Agarwal, Anant",2023-03-29T15:36:04Z,2023-03-29T15:36:04Z,2002-07,https://hdl.handle.net/1721.1/149959,MIT-LCS-TR-859,Scalar Operand Networks: On-chip interconnect for ILP in Partitioned Architechures,,,,,,
"Strumpen, Volker; Krishnamurthy, Arvind",2023-03-29T14:42:47Z,2023-03-29T14:42:47Z,2002-07,https://hdl.handle.net/1721.1/149318,MIT-LCS-TM-629,A Collision Model for Randomized Routing In Fat-Tree Networks,,,,,,
"Werfel, Justin",2004-10-08T20:38:09Z,2004-10-08T20:38:09Z,2002-07-01,http://hdl.handle.net/1721.1/6696,AIM-2002-010,Implementing Universal Computation in an Evolutionary System,AIM-2002-010,"Evolutionary algorithms are a common tool in  engineering and in the study of natural  evolution. Here we take their use in a new  direction by showing how they can be made to  implement a universal computer. We  consider populations of individuals with  genes whose values are the variables of  interest. By allowing them to interact with one  another in a specified environment with  limited resources, we demonstrate the ability  to construct any arbitrary logic circuit. We  explore models based on the limits of small  and large populations, and show examples of  such a system in action, implementing a  simple logic circuit.",17 p.; 3942374 bytes; 1153028 bytes,application/postscript; application/pdf,en_US,AI
"Clarke, Dwaine; Gassend, Blaise; Suh, G. Edward; van Dijk, Marten; Devadas, Srinivas",2023-03-29T14:42:58Z,2023-03-29T14:42:58Z,2002-08,https://hdl.handle.net/1721.1/149320,MIT-LCS-TM-631,Offline Authentication of Untrusted Storage,,"We extend the offline memory correctness checking scheme presented by Blum et. al [BEG+91], by using incremental cryptography, to detect attacks by an active adversary. We also introduce a hybrid o_ine-online checking scheme designed for untrusted storages in file systems and databases. Previous work [GSC+02] [FKM00] [MVS00] describe systems in which Merkle trees are used to verify the authenticity of data stored on untrusted storage. The Merkle trees [Mer79] are used to check, after each operation, whether the storage performed correctly. The offline and hybrid checkers are designed for checking sequences of operations on an untrusted storage and, in the common case, require only a constant overhead on the number of accesses to the storage, as compared to the logarithmic overhead incurred by online Merkle tree schemes",,,,
"Aftab, Omar",2023-03-29T15:36:38Z,2023-03-29T15:36:38Z,2002-08,https://hdl.handle.net/1721.1/149972,MIT-LCS-TR-876b,Economic Mechanisms for Efficient Wireless Coexistence,,,,,,
"Thies, William; Lin, Jasper; Amarasinghe, Saman",2023-03-29T14:42:53Z,2023-03-29T14:42:53Z,2002-08,https://hdl.handle.net/1721.1/149319,MIT-LCS-TM-630,Phased Computation Graphs in the Polyhedral Model,,"We present a translation scheme that allows a broad class of dataflow graphs to be considered under the optimization framework of the polyhedral model. The input to our analysis is a Phased Computation Graph, which we define as a generalization of the most widely used dataflow representations, including synchronous dataflow, cyclo-static dataflow, and computation graphs. The output of our analysis is a System of Affine Recurrence Equations (SARE) that exactly captures the data dependencies between the nodes of the original graph. Using the SARE representation, one can apply many techniques from the scientific community that are new to the DSP domain. For example, we propose simple optimizations such as node splitting, decimation propagation, and stead-state invariant code motion that leverage the fine-grained dependence information of the SARE to perform novel transformations on a stream graph. We also propose ways in which the polyhedral model can offer new approaches to classic problems of the DSP community, such as minimizing buffer size, code size, and optimizing the schedule.",,,,
"Schneider, Robert; Riesenhuber, Maximilian",2004-10-20T20:48:51Z,2004-10-20T20:48:51Z,2002-08-01,http://hdl.handle.net/1721.1/7178,AIM-2002-011; CBCL-218,A Detailed Look at Scale and Translation Invariance in a Hierarchical Neural Model of Visual Object Recognition,AIM-2002-011; CBCL-218,"The HMAX model has recently been proposed  by Riesenhuber & Poggio as a  hierarchical  model of position- and size-invariant object  recognition in visual cortex. It has also turned  out to model successfully a number of other  properties of the ventral visual stream (the  visual pathway thought to be crucial for object  recognition in cortex), and particularly of (view-tuned) neurons in macaque inferotemporal  cortex, the brain area at the top of the ventral  stream. The original modeling study only  used ``paperclip'' stimuli, as in the  corresponding physiology experiment, and did  not explore systematically how model units'  invariance properties depended on model  parameters. In this study, we aimed at a  deeper understanding of the inner workings of  HMAX and its performance for various  parameter settings and ``natural'' stimulus  classes. We examined HMAX responses for  different stimulus sizes and positions  systematically and found a dependence of  model units' responses on stimulus position  for which a quantitative description is offered.  Interestingly, we find that scale invariance  properties of hierarchical neural models are  not independent of stimulus class, as  opposed to translation invariance, even  though both are affine transformations within  the image plane.",12 p.; 2137337 bytes; 1062341 bytes,application/postscript; application/pdf,en_US,AI
"Giese, Martin Alexander; Poggio, Tomaso",2004-10-20T21:05:04Z,2004-10-20T21:05:04Z,2002-08-01,http://hdl.handle.net/1721.1/7272,AIM-2002-012; CBCL-219,Biologically Plausible Neural Model for the Recognition of Biological Motion and Actions,AIM-2002-012; CBCL-219,"The visual recognition of complex movements  and actions is crucial for communication and  survival in many species. Remarkable  sensitivity and robustness of biological  motion perception have been demonstrated in  psychophysical experiments. In recent years,  neurons and cortical areas involved in action  recognition have been identified in  neurophysiological and imaging studies.  However, the detailed neural mechanisms  that underlie the recognition of such complex  movement patterns remain largely unknown.  This paper reviews the experimental results  and summarizes them in terms of a  biologically plausible neural model. The  model is based on the key assumption that  action recognition is based on learned  prototypical patterns and exploits information  from the ventral and the dorsal pathway. The  model makes specific predictions that  motivate new experiments.",26 p.; 3562724 bytes; 2540946 bytes,application/postscript; application/pdf,en_US,AI; biological motion; action recognition; visual pathways; hierarchical processing
"Giese, M.A.; Xie, X.",2004-10-20T21:05:06Z,2004-10-20T21:05:06Z,2002-08-01,http://hdl.handle.net/1721.1/7273,AIM-2002-013; CBCL-220,Exact Solution of the Nonlinear Dynamics of Recurrent Neural Mechanisms for Direction Selectivity,AIM-2002-013; CBCL-220,"Different theoretical models have tried to  investigate the feasibility of recurrent neural  mechanisms for achieving direction selectivity  in the visual cortex. The mathematical  analysis of such models has been restricted  so far to the case of purely linear networks.  We present an exact analytical solution of the  nonlinear dynamics of a class of direction  selective recurrent neural models with  threshold nonlinearity. Our mathematical  analysis shows that such networks have  form-stable stimulus-locked traveling pulse  solutions that are appropriate for modeling  the responses of direction selective cortical  neurons. Our analysis shows also that the  stability of such solutions can break down  giving raise to a different class of solutions  (""lurching activity waves"") that are  characterized by a specific spatio-temporal  periodicity. These solutions cannot arise in  models for direction selectivity with purely  linear spatio-temporal filtering.",7 p.; 2554351 bytes; 1165357 bytes,application/postscript; application/pdf,en_US,AI; direction; visual cortex; nonlinear dynamics; lurching waves; stability; recurre
"Hajiaghayi, Mohammad Taghi; Mahdian, Mohammad; Mirrokni, Vahab S.",2023-03-29T15:36:07Z,2023-03-29T15:36:07Z,2002-09,https://hdl.handle.net/1721.1/149960,MIT-LCS-TR-864,The Facility Location Problem with Concave Cost Functions,,,,,,
"Raman, Sanjay; Clarke, Dwaine; Burnside, Matt; Devadas, Srinivas; Rivest, Ronald L.",2023-03-29T15:36:22Z,2023-03-29T15:36:22Z,2002-09,https://hdl.handle.net/1721.1/149966,MIT-LCS-TR-870,Access-Controlled Resource Discovery for Pervasive Networks,,"Networks of the future will be characterized by a variety of computational devices that display a level of dynamism not seen in traditional wired networks. Because of the dynamic nature of these networks, resource discovery is one of the fundamental problems that must be faced. While resource discovery systems are not a novel concept, securing these systems in an efficient and scalable way is challenging. This paper describes the design and implementation of an architecture for access-controlled resource discovery. This system achieves this goal by integrating access control with the Intentional Naming System (INS), a resource discovery and service location system. The integration is scalable, efficient, and fits well within a proxy-based security framework designed for dynamic networks. We provide performance experiments that show how our solution outperforms existing schemes. The result is a system that provides secure, access-controlled resource discovery that can scale to large numbers of resources and users",,,,
"Steck, Harald; Jaakkola, Tommi S.",2004-10-08T20:38:20Z,2004-10-08T20:38:20Z,2002-09-01,http://hdl.handle.net/1721.1/6702,AIM-2002-014,On the Dirichlet Prior and Bayesian Regularization,AIM-2002-014,"A common objective in learning a model from  data is to recover its network structure, while the model  parameters are of minor interest. For example, we may wish to recover  regulatory networks from high-throughput data sources. In this paper  we examine how Bayesian regularization using a Dirichlet prior over the  model parameters affects the learned model structure in a  domain with discrete variables. Surprisingly, a weak prior in the  sense of smaller equivalent sample size leads to a strong  regularization of the model structure (sparse graph) given a sufficiently  large data set. In particular, the empty graph is obtained in the  limit of a vanishing strength of prior belief. This is  diametrically opposite to what one may expect in this limit, namely the  complete graph from an (unregularized) maximum likelihood estimate.  Since the prior affects the parameters as expected, the prior strength  balances a ""trade-off"" between regularizing the parameters or the  structure of the model. We demonstrate the benefits of optimizing this  trade-off in the sense of predictive accuracy.",11 p.; 3152389 bytes; 1414851 bytes,application/postscript; application/pdf,en_US,AI; Regularization; Dirichlet Prior
"Freeman, William T.; Torralba, Antonio",2004-10-08T20:38:34Z,2004-10-08T20:38:34Z,2002-09-01,http://hdl.handle.net/1721.1/6704,AIM-2002-016,Shape Recipes: Scene Representations that Refer to the Image,AIM-2002-016,"The goal of low-level vision is to estimate an  underlying scene, given an observed image. Real-world scenes  (e.g., albedos or shapes) can be very complex, conventionally requiring  high dimensional representations which are hard to estimate  and store. We propose a low-dimensional representation, called a  scene recipe, that relies on the image itself to describe the  complex scene configurations. Shape recipes are an  example: these are the regression coefficients that predict the  bandpassed shape from bandpassed image data. We describe the  benefits of this representation, and show two uses  illustrating their properties: (1) we improve stereo shape estimates by  learning shape recipes at low resolution and applying them at full resolution;  (2) Shape recipes implicitly contain information about lighting  and materials and we use them for material segmentation.",12 p.; 2606902 bytes; 1497926 bytes,application/postscript; application/pdf,en_US,AI; scene representation; shape; stereo; shape recipes
"Tappen, Marshall F.; Freeman, William T.; Adelson, Edward H.",2004-10-08T20:38:21Z,2004-10-08T20:38:21Z,2002-09-01,http://hdl.handle.net/1721.1/6703,AIM-2002-015,Recovering Intrinsic Images from a Single Image,AIM-2002-015,"We present an algorithm that uses multiple  cues to recover shading and reflectance intrinsic images from a single  image. Using both color information and a classifier trained to  recognize gray-scale patterns, each image derivative is classified as being  caused by shading or a change in the surface's reflectance.  Generalized Belief Propagation is then used to propagate information from  areas where the correct classification is clear to areas where it is  ambiguous. We also show results on real images.",12 p.; 1591784 bytes; 1186163 bytes,application/postscript; application/pdf,en_US,AI; intrinisic images; reflectance estimation
"Kumar, Vinay P.",2004-10-01T14:00:07Z,2004-10-01T14:00:07Z,2002-09-01,http://hdl.handle.net/1721.1/5569,AITR-2002-008; CBCL-221,Towards Man-Machine Interfaces: Combining Top-down Constraints with Bottom-up Learning in Facial Analysis,AITR-2002-008; CBCL-221,"This thesis proposes a methodology for the  design of man-machine interfaces by combining top-down and  bottom-up processes in vision. From a computational perspective, we  propose that the scientific-cognitive question of combining top-down and bottom-up knowledge is similar to the engineering  question of labeling a training set in a supervised learning problem.  We investigate these questions in the realm  of facial analysis. We propose the use of a linear morphable model  (LMM) for representing top-down structure and use it to model  various facial variations such as mouth shapes and expression, the pose of  faces and visual speech (visemes). We apply a supervised learning  method based on support vector machine (SVM) regression for  estimating the parameters of LMMs directly from pixel-based representations of  faces. We combine these methods for designing new, more self-contained systems for recognizing facial expressions, estimating facial pose and  for recognizing visemes.",68 p.; 21293042 bytes; 2473001 bytes,application/postscript; application/pdf,en_US,AI; Facial Expression Recognition; Pose Estimation; Viseme Recognition; SVM
"Demaine, Erik D.; Hohenberger, Susan; Liben-Nowell, David",2023-03-29T15:36:10Z,2023-03-29T15:36:10Z,2002-10,https://hdl.handle.net/1721.1/149961,MIT-LCS-TR-865,"Tetris is Hard, Even to Approximate",,,,,,
"Livadas, Carolos; Keidar, Idit",2023-03-29T15:36:15Z,2023-03-29T15:36:15Z,2002-10,https://hdl.handle.net/1721.1/149963,MIT-LCS-TR-867,The Case for Exploiting Packet Loss Locality in Multicast Loss Recovery,,,,,,
