dc.contributor.advisor,dc.contributor.author,dc.contributor.other,dc.date.accessioned,dc.date.available,dc.date.issued,dc.identifier.other,dc.identifier.uri,dc.description.abstract,dc.format.extent,dc.format.mimetype,dc.language.iso,dc.relation.ispartofseries,dc.title,dc.subject,dc.identifier.citation,dc.description,dc.relation.replaces,dc.relation.uri,dc.relation.isreplacedby,dc.relation,dc.rights,dc.rights.uri,dc.date.updated
Trevor Darrell,"Grauman, Kristen Lorraine",Vision,2008-06-16T14:15:28Z,2008-06-16T14:15:28Z,2006-08-11,MIT-CSAIL-TR-2008-035,http://hdl.handle.net/1721.1/41864,"In numerous domains it is useful to represent a single example by the collection of local features or parts that comprise it. In computer vision in particular, local image features are a powerful way to describe images of objects and scenes. Their stability under variable image conditions is critical for success in a wide range of recognition and retrieval applications. However, many conventional similarity measures and machine learning algorithms assume vector inputs. Comparing and learning from images represented by sets of local features is therefore challenging, since each set may vary in cardinality and its elements lack a meaningful ordering. In this thesis I present computationally efficient techniques to handle comparisons, learning, and indexing with examples represented by sets of features. The primary goal of this research is to design and demonstrate algorithms that can effectively accommodate this useful representation in a way that scales with both the representation size as well as the number of images available for indexing or learning.I introduce the pyramid match algorithm, which efficiently forms an implicit partial matching between two sets of feature vectors. The matching has a linear time complexity, naturally forms a Mercer kernel, and is robust to clutter or outlier features, a critical advantage for handling images with variable backgrounds, occlusions, and viewpoint changes. I provide bounds on the expected error relative to the optimal partial matching. For very large databases, even extremely efficient pairwise comparisons may not offer adequately responsive query times. I show how to perform sub-linear time retrievals under the matching measure with randomized hashing techniques, even when input sets have varying numbers of features.My results are focused on several important vision tasks, including applications to content-based image retrieval, discriminative classification for object recognition, kernel regression, and unsupervised learning of categories. I show how the dramatic increase in performance enables accurate and flexible image comparisons to be made on large-scale data sets, and removes the need to artificially limit the number of local descriptions used per image when learning visual categories.",153 p.,,,,Matching Sets of Features for Efficient Retrieval and Recognition,"object recognition, partial match, matching approximation, pyramid match kernel, image matching, image search, correspondences, local image features",,,,,,Massachusetts Institute of Technology Computer Science and Artificial Intelligence Laboratory; ,,,
Brian Williams,"Effinger, Robert",Model-based Embedded and Robotic Systems,2018-01-30T23:46:07Z,2018-01-30T23:46:07Z,2006-08-25,,http://hdl.handle.net/1721.1/113365,"Autonomous robots are being considered for increasingly capable roles in our society, such as urban search and rescue, automation for assisted living, and lunar habitat construction. To fulfill these roles, teams of autonomous robots will need to cooperate together to accomplish complex mission objectives in uncertain and dynamic environments. In these environments, autonomous robots face a host of new challenges, such as responding robustly to timing uncertainties and perturbations, task and coordination failures, and equipment malfunctions. In order to address these challenges, this thesis advocates a novel planning approach, called temporally-flexible contingent planning. A temporally-flexible contingent plan is a compact encoding of methods for achieving the mission objectives which incorporates robustness through flexible task durations, redundant methods, constraints on when methods are applicable, and preferences between methods. This approach enables robots to adapt to unexpected changes on-the-fly by selecting alternative methods at runtime in order to satisfy as best possible the mission objectives. The drawback to this approach, however, is the computational overhead involved in selecting alternative methods at runtime in response to changes. If a robot takes too long to select a new plan, it could fail to achieve its near-term mission objectives and potentially incur damage. To alleviate this problem, and extend the range of applicability of temporally-flexible contingent planning to more demanding real-time systems, this thesis proposes a temporally-flexible contingent plan executive that selects new methods quickly and optimally in response to changes in a robot's health and environment. We enable fast and optimal method selection through two complimentary approaches. First, we frame optimal method selection as a constraint satisfaction problem (CSP) variant, called an Optimal Conditional CSP (OCCSP). Second, we extend fast CSP search algorithms, such as Dynamic Backtracking and Branch-and-Bound Search, to solve OCCSPs. Experiments on an autonomous rover test-bed and on randomly generated plans show that these contributions significantly improve the speed at which robots perform optimal method selection in response to changes in their health status and environment.",115 p.,,,MIT-CSAIL-TR-2018-005,Optimal Temporal Planning at Reactive Time Scales via Dynamic Backtracking Branch and Bound,,,SM thesis,,,,,Creative Commons Attribution-NonCommercial-NoDerivatives 4.0 International,http://creativecommons.org/licenses/by-nc-nd/4.0/,2018-01-30T23:46:07Z
Peter Szolovits,"Hug, Caleb W.",Clinical Decision-Making,2006-08-31T14:29:11Z,2006-08-31T14:29:11Z,2006-08-30,MIT-CSAIL-TR-2006-055,http://hdl.handle.net/1721.1/33957,"Using artificial intelligence to assist physicians in patient care has received sustained interest over the past several decades.  Recently, with automated systems at most bedsides, the amount of patient information collected continues to increase, providing specific impetus for intelligent systems that can interpret this information. In fact, the large set of sensors and test results, often measured repeatedly over long periods of time, make it challenging for caregivers to quickly utilize all of the data for optimal patient treatment.This research focuses on predicting the survival of ICU patients throughout their stay.  Unlike traditional static mortality models, this survival prediction is explored as an indicator of patient state and trajectory.  Using survival analysis techniques and machine learning, models are constructed that predict individual patient survival probabilities at fixed intervals in the future.  These models seek to help physicians interpret the large amount of data available in order to provide optimal patient care.We find that the survival predictions from our models are comparable to survival predictions using the SAPS score, but are available throughout the patient's ICU course instead of only at 24 hours after admission.  Additionally, we demonstrate effective prediction of patient mortality over fixed windows in the future.",126 p.; 3075332 bytes; 103809024 bytes,application/pdf; application/postscript,en_US,Massachusetts Institute of Technology Computer Science and Artificial Intelligence Laboratory,Predicting the Risk and Trajectory of Intensive Care Patients Using Survival Models,Intelligent Monitoring,,SM thesis,,,,,,,
Michael Ernst,"Artzi, Shay; Ernst, Michael D.; Kiezun, Adam; Pacheco, Carlos; Perkins, Jeff H.",Program Analysis,2006-09-05T16:31:22Z,2006-09-05T16:31:22Z,2006-08-31,MIT-CSAIL-TR-2006-056,http://hdl.handle.net/1721.1/33959,"A test input for an object-oriented program typically consists of asequence of method calls that use the API defined by the programunder test. Generating legal test inputs can be challenging because,for some programs, the set of legal method sequences is much smallerthan the set of all possible sequences; without a formalspecification of legal sequences, an input generator is bound toproduce mostly illegal sequences.We propose a scalable technique that combines dynamic analysis withrandom testing to help an input generator create legal test inputswithout a formal specification, even for programs in whichmost sequences are illegal. The technique uses an example executionof the program to infer a model of legal call sequences, and usesthe model to guide a random input generator towards legal butbehaviorally-diverse sequences.We have implemented our technique for Java, in a tool calledPalulu, and evaluated its effectiveness in creating legal inputsfor real programs. Our experimental results indicate that thetechnique is effective and scalable. Our preliminary evaluationindicates that the technique can quickly generate legal sequencesfor complex inputs: in a case study, Palulu created legal testinputs in seconds for a set of complex classes, for which it took anexpert thirty minutes to generate a single legal input.",8 p.; 412269 bytes; 923064 bytes,application/pdf; application/postscript,en_US,Massachusetts Institute of Technology Computer Science and Artificial Intelligence Laboratory,Finding the needles in the haystack: Generating legal test inputs for object-oriented programs,,,,,,,,,,
Tommi Jaakkola,"Monteleoni, Claire E.",Tommi's Machine Learning,2006-09-05T16:26:12Z,2006-09-05T16:26:12Z,2006-09-01,MIT-CSAIL-TR-2006-057,http://hdl.handle.net/1721.1/33958,"Many practical problems such as forecasting, real-time decisionmaking, streaming data applications, and resource-constrainedlearning, can be modeled as learning with online constraints.  Thisthesis is concerned with analyzing and designing algorithms forlearning under the following online constraints: 1) The algorithm hasonly sequential, or one-at-time, access to data.  2) The time andspace complexity of the algorithm must not scale with the number ofobservations.  We analyze learning with online constraints in avariety of settings, including active learning.  The active learningmodel is applicable to any domain in which unlabeled data is easy tocome by and there exists a (potentially difficult or expensive)mechanism by which to attain labels.First, we analyze a supervised learning framework in which nostatistical assumptions are made about the sequence of observations,and algorithms are evaluated based on their regret, i.e. theirrelative prediction loss with respect to the hindsight-optimalalgorithm in a comparator class.  We derive a lower bound on regretfor a class of online learning algorithms designed to track shiftingconcepts in this framework.  We apply an algorithm we provided inprevious work, that avoids this lower bound, to an energy-managementproblem in wireless networks, and demonstrate this application in anetwork simulation. Second, we analyze a supervised learning frameworkin which the observations are assumed to be iid, and algorithms arecompared by the number of prediction mistakes made in reaching atarget generalization error.  We provide a lower bound on mistakes forPerceptron, a standard online learning algorithm, for this framework.We introduce a modification to Perceptron and show that it avoids thislower bound, and in fact attains the optimal mistake-complexity forthis setting.Third, we motivate and analyze an online active learning framework.The observations are assumed to be iid, and algorithms are judged bythe number of label queries to reach a target generalizationerror. Our lower bound applies to the active learning setting as well,as a lower bound on labels for Perceptron paired with any activelearning rule.  We provide a new online active learning algorithm thatavoids the lower bound, and we upper bound its label-complexity.  Theupper bound is optimal and also bounds the algorithm's total errors(labeled and unlabeled).  We analyze the algorithm further, yielding alabel-complexity bound under relaxed assumptions.  Using opticalcharacter recognition data, we empirically compare the new algorithmto an online active learning algorithm with data-dependent performanceguarantees, as well as to the combined variants of these twoalgorithms.",102 p.; 11237521 bytes; 2402633 bytes,application/postscript; application/pdf,en_US,Massachusetts Institute of Technology Computer Science and Artificial Intelligence Laboratory,Learning with Online Constraints: Shifting Concepts and Active Learning,,,PhD thesis,,,,,,,
William Freeman,"Fergus, Rob; Torralba, Antonio; Freeman, William T.",Vision,2006-09-07T18:46:57Z,2006-09-07T18:46:57Z,2006-09-02,MIT-CSAIL-TR-2006-058,http://hdl.handle.net/1721.1/33962,"We call a random lens one for which the function relating the input light ray to the output sensor location is pseudo-random. Imaging systems with random lensescan expand the space of possible camera designs, allowing new trade-offs in optical design and potentially adding new imaging capabilities. Machine learningmethods are critical for both camera calibration and image reconstruction from the sensor data. We develop the theory and compare two different methods for calibration and reconstruction: an MAP approach, and basis pursuit from compressive sensing. We show proof-of-concept experimental results from a random lens made from a multi-faceted mirror, showing successful calibration and image reconstruction. We illustrate the potential for super-resolution and 3D imaging.",9 p.; 52671890 bytes; 1133927 bytes,application/postscript; application/pdf,en_US,Massachusetts Institute of Technology Computer Science and Artificial Intelligence Laboratory,Random Lens Imaging,,,,,,,,,,
