dc.contributor.author,dc.contributor.other,dc.date.accessioned,dc.date.available,dc.date.issued,dc.identifier.other,dc.identifier.uri,dc.description.abstract,dc.format.extent,dc.format.mimetype,dc.language.iso,dc.relation.ispartofseries,dc.title,dc.subject
"Torralba, Antonio",,2004-10-08T20:43:12Z,2004-10-08T20:43:12Z,2004-04-14,AIM-2004-009,http://hdl.handle.net/1721.1/6737,"This article describes a model for including scene/context priors in attention guidance. In the proposed scheme, visual context information can be available early in the visual processing chain, in order to modulate the saliency of image regions and to provide an efficient short cut for object detection and recognition. The scene is represented by means of a low-dimensional global description obtained from low-level features. The global scene features are then used to predict the probability of presence of the target object in the scene, and its location and scale, before exploring the image. Scene information can then be used to modulate the saliency of image regions early during the visual processing in order to provide an efficient short cut for object detection and recognition.",12 p.; 2980182 bytes; 1698158 bytes,application/postscript; application/pdf,en_US,AIM-2004-009,Contextual Influences on Saliency,AI; Attention; context; saliency; scene recognition; object detection
"Katti, Sachin; Katabi, Dina; Kohler, Eddie; Strauss, Jacob",Networks and Mobile Systems,2005-12-22T01:27:11Z,2005-12-22T01:27:11Z,2004-04-14,MIT-CSAIL-TR-2004-022; MIT-LCS-TR-945,http://hdl.handle.net/1721.1/30462,"This paper presents M&M, a passive measurement toolkitsuitable for large-scale studies of Internet path characteristics.The multiQ tool uses equally-spaced mode gaps in TCP flowspacket interarrival time distributions to detect multiple bottleneckcapacities and their relative order. Unlike previous tools,multiQ can discover up to three bottlenecks fromthe tcpdumptrace of a single flow, and can work with acknowledgment aswell as data interarrivals.We also describe the mystery tool, asimple TCP loss event, packet loss, and RTT analyzer designedto work in concert with multiQ. The M&M toolkit can measuresimple path properties; correlate different types of measurementof the same path, producing new kinds of results; andbecause M&M is passive, it can use publicly-available traces totrack the value of a measurement over multiple years.We validate our tools in depth using the RON overlay network[4], which provides more than 400 heterogeneous Internetpaths and detailed information about their characteristics.We compare multiQ with Nettimer and Pathrate, two othercapacity measurement tools, in the first wide-area, real-worldvalidation of capacity measurement techniques. Each tool accuratelydiscovers minimum capacities (85% of measurementsare within 10%of the true value); multiQ additionally discoversmultiple bottlenecks and their orderings. We also use ourtoolkit to perform several measurement studies using a reservoirof 375 million traced packets spanning the last two years.Among the results of these studies are that bottleneck capacityon our traced links has gone up by around an order ofmagnitudefrom 2002 to 2004, and that differences in levels of statisticalmultiplexing on 10 Mb/s and 100 Mb/s bottleneck links resultin flows over those links having similar fair-share bandwidths.",13 p.; 25499604 bytes; 1134347 bytes,application/postscript; application/pdf,en_US,Massachusetts Institute of Technology Computer Science and Artificial Intelligence Laboratory,"M&M: A Passive Toolkit for Measuring, Correlating, and Tracking Path Characteristics",
"Torralba, Antonio; Murphy, Kevin P.; Freeman, William T.",,2004-10-08T20:43:10Z,2004-10-08T20:43:10Z,2004-04-14,AIM-2004-008,http://hdl.handle.net/1721.1/6736,"We consider the problem of detecting a large number of different classes of objects in cluttered scenes. Traditional approaches require applying a battery of different classifiers to the image, at multiple locations and scales. This can be slow and can require a lot of training data, since each classifier requires the computation of many different image features. In particular, for independently trained detectors, the (run-time) computational complexity, and the (training-time) sample complexity, scales linearly with the number of classes to be detected. It seems unlikely that such an approach will scale up to allow recognition of hundreds or thousands of objects.  We present a multi-class boosting procedure (joint boosting) that reduces the computational and sample complexity, by finding common features that can be shared across the classes (and/or views). The detectors for each class are trained jointly, rather than independently. For a given performance level, the total number of features required, and therefore the computational cost, is observed to scale approximately logarithmically with the number of classes. The features selected jointly are closer to edges and generic features typical of many natural structures instead of finding specific object parts. Those generic features generalize better and reduce considerably the computational cost of an algorithm for multi-class object detection.",17 p.; 4223512 bytes; 1537371 bytes,application/postscript; application/pdf,en_US,AIM-2004-008,Sharing visual features for multiclass and multiview object detection,AI; Object detection; sharing features; feature selection; multiclass; Boosting
"Torralba, Antonio",,2005-12-22T01:26:54Z,2005-12-22T01:26:54Z,2004-04-14,MIT-CSAIL-TR-2004-020; AIM-2004-009,http://hdl.handle.net/1721.1/30460,"This article describes a model for including scene/context priors in attention guidance. In the proposed scheme, visual context information can be available early in the visual processing chain, in order to modulate the saliency of image regions and to provide an efficient short cut for object detection and recognition. The scene is represented by means of a low-dimensional global description obtained from low-level features. The global scene features are then used to predict the probability of presence of the target object in the scene, and its location and scale, before exploring the image. Scene information can then be used to modulate the saliency of image regions early during the visual processing in order to provide an efficient short cut for object detection and recognition.",12 p.; 18377938 bytes; 597436 bytes,application/postscript; application/pdf,en_US,Massachusetts Institute of Technology Computer Science and Artificial Intelligence Laboratory,Contextual Influences on Saliency,AI; Attention; context; saliency; scene recognition; object detection
"Weinstein, Eugene; Steele, Kenneth; Agarwal, Anant; Glass, James",Computer Architecture,2005-12-22T01:27:05Z,2005-12-22T01:27:05Z,2004-04-14,MIT-CSAIL-TR-2004-021; MIT-LCS-TM-642,http://hdl.handle.net/1721.1/30461,"Ubiquitous computing environments are characterized by an unboundedamount of noise and crosstalk. In these environments, traditionalmethods of sound capture are insufficient, and array microphones areneeded in order to obtain a clean recording of desired speech. In thiswork, we have designed, implemented, and tested LOUD, a novel 1020-nodemicrophone array utilizing the Raw tile parallel processorarchitecture for computation. To the best of our knowledge,this is currently the largest microphone array in the world. We haveexplored the uses of the array within ubiquitous computing scenarios byimplementing an acoustic beamforming algorithm for sound sourceamplification in a noisy environment, and have obtained preliminaryresults demonstrating the efficacy of the array. From one to 1020microphones, we have shown a 13.7dB increase in peak SNR on arepresentative utterance, an 87.2% drop in word error rate withinterferer present, and an 89.6% drop in WER without an interferer.",18 p.; 26946578 bytes; 901671 bytes,application/postscript; application/pdf,en_US,Massachusetts Institute of Technology Computer Science and Artificial Intelligence Laboratory,A 1020-Node Modular Microphone Array and Beamformer for Intelligent Computing Spaces,
"Torralba, Antonio; Murphy, Kevin P.; Freeman, William T.",,2005-12-19T22:41:45Z,2005-12-19T22:41:45Z,2004-04-14,MIT-CSAIL-TR-2004-019; AIM-2004-008,http://hdl.handle.net/1721.1/30399,"We consider the problem of detecting a large number of different classes of objects in cluttered scenes. Traditional approaches require applying a battery of different classifiers to the image, at multiple locations and scales. This can be slow and can require a lot of training data, since each classifier requires the computation of many different image features. In particular, for independently trained detectors, the (run-time) computational complexity, and the (training-time) sample complexity, scales linearly with the number of classes to be detected. It seems unlikely that such an approach will scale up to allow recognition of hundreds or thousands of objects.We present a multi-class boosting procedure (joint boosting) that reduces the computational and sample complexity, by finding common features that can be shared across the classes (and/or views). The detectors for each class are trained jointly, rather than independently. For a given performance level, the total number of features required, and therefore the computational cost, is observed to scale approximately logarithmically with the number of classes. The features selected jointly are closer to edges and generic features typical of many natural structures instead of finding specific object parts. Those generic features generalize better and reduce considerably the computational cost of an algorithm for multi-class object detection.",17 p.; 24172096 bytes; 1434721 bytes,application/postscript; application/pdf,en_US,Massachusetts Institute of Technology Computer Science and Artificial Intelligence Laboratory,Sharing visual features for multiclass and multiview object detection,AI; Object detection; sharing features; feature selection; multiclass; Boosting
