dc.contributor.advisor,dc.contributor.author,dc.contributor.other,dc.date.accessioned,dc.date.available,dc.date.issued,dc.identifier.uri,dc.description.abstract,dc.format.extent,dc.relation.ispartofseries,dc.subject,dc.title,dc.date.updated,dc.rights,dc.rights.uri,dc.relation.haspart,dc.description.sponsorship,dc.language.iso,dc.publisher,dc.type,dc.identifier.citation,dc.description
,"Shen, Jiasi; Rinard, Martin",,2018-08-28T17:22:15Z,2018-08-28T17:22:15Z,2018-08-28,http://hdl.handle.net/1721.1/117593,"We present a new technique that uses active learning to infer models of 
applications that manipulate relational databases. This technique 
comprises a domain-specific language for modeling applications that 
access databases (each model is a program in this language) and an 
associated inference algorithm that infers models of applications whose 
behavior can be expressed in this language. The inference algorithm 
generates test inputs and database configurations, runs the application, 
then observes the resulting database traffic and outputs to 
progressively refine its current model hypothesis.  The end result is a 
model that completely captures the behavior of the application.  Because 
the technique works only with the externally observable inputs, outputs, 
and databases, it can infer the behavior of applications written in 
arbitrary languages using arbitrary coding styles (as long as the 
behavior of the application is expressible in the domain-specific language).

We also present a technique for automatically regenerating an 
implementation from the inferred model. The regenerator can produce a 
translated implementation in a different language and systematically 
include relevant security and error checks.",,,,Using Active Learning to Synthesize Models of Applications That  Access Databases,,,,,,,,Article,,
,"Shen, Jiasi; Rinard, MArtin",,2018-09-27T13:22:38Z,2018-09-27T13:22:38Z,2018-09-27,http://hdl.handle.net/1721.1/118184,"We previously developed Konure, a tool that uses active learning to 
infer the functionality of database applications. An alternative 
approach is to observe the inputs, outputs, and database traffic from a 
running system in normal use and then synthesize a model of the 
application from this information.  To evaluate these two approaches, we 
present Etch, which uses information from typical usage scenarios to 
synthesize a model of the functionality of database applications whose 
computation can be expressed in the Konure DSL.",,,,Using Dynamic Monitoring to Synthesize Models of Applications That  Access Databases,,,,,,en_US,,Article,,
,"Kawaguchi, Kenji; Benigo, Yoshua; Verma, Vikas; Kaelbling, Leslie Pack",,2018-10-01T15:44:44Z,2018-10-01T15:44:44Z,2018-10-01,http://hdl.handle.net/1721.1/118307,"This paper introduces a novel measure-theoretic theory for machine learning
that does not require statistical assumptions. Based on this theory, a new
regularization method in deep learning is derived and shown to outperform
previous methods in CIFAR-10, CIFAR-100, and SVHN. Moreover, the proposed
theory provides a theoretical basis for a family of practically successful
regularization methods in deep learning. We discuss several consequences of
our results on one-shot learning, representation learning, deep learning,
and curriculum learning. Unlike statistical learning theory, the proposed
learning theory analyzes each problem instance individually via measure
theory, rather than a set of problem instances via statistics. As a result,
it provides different types of results and insights when compared to
statistical learning theory.",,;MIT-CSAIL-TR-2018-019,Machine Learning; Measure Theory; Regularization method; Neural Network,Towards Understanding Generalization via Analytical Learning Theory,,,,,,en_US,,Article,,
