dc.contributor.advisor,dc.contributor.author,dc.contributor.other,dc.date.accessioned,dc.date.available,dc.date.issued,dc.identifier.other,dc.identifier.uri,dc.description.abstract,dc.format.extent,dc.format.mimetype,dc.language.iso,dc.relation.ispartofseries,dc.subject,dc.title,dc.identifier.citation,dc.rights,dc.rights.uri,dc.relation,dc.description,dc.relation.isreplacedby,dc.relation.uri,dc.relation.replaces
Srini Devadas,"O'Donnell, Charles W.; Suh,, G. Edward; Dijk, Marten vn; Devadas, Srinivas",Computation Structures,2006-12-08T16:51:48Z,2006-12-08T16:51:48Z,2006-12-08,MIT-CSAIL-TR-2006-080,http://hdl.handle.net/1721.1/34954,"Application source code protection is a major concern for software architects today. Secure platforms have been proposed that protect the secrecy of application algorithms and enforce copy protection assurances. Unfortunately, these capabilities incur a sizeable performance overhead. Partitioning an application into secure and insecure regions can help diminish these overheads but invalidates guarantees of code secrecy and copy protection.This work examines one of the problems of partitioning an application into public and private regions, the ability of an adversary to recreate those private regions. To our knowledge, it is the first to analyze this problem when considering application operation as a whole. Looking at the fundamentals of the issue, we analyze one of the simplest attacks possible, a ``Memoization Attack.'' We implement an efficient Memoization Attack and discuss necessary techniques that limit storage and computation consumption. Experimentation reveals that certain classes of real-world applications are vulnerable to Memoization Attacks. To protect against such an attack, we propose a set of indicator tests that enable an application designer to identify susceptible application code regions.",11 p.; 436268 bytes; 1481611 bytes,application/pdf; application/postscript,en_US,Massachusetts Institute of Technology Computer Science and Artificial Intelligence Laboratory,Security; Architecture; Trusted Execution; Security Analysis; Digital Rights Management,Memoization Attacks and Copy Protection in Partitioned Applications,,,,,,,,
Shafi Goldwasser,"Pass, Rafael; Shelat, Abhi; Vaikuntanathan, Vinod",Theory of Computation,2006-12-14T14:51:47Z,2006-12-14T14:51:47Z,2006-12-14,MIT-CSAIL-TR-2006-081,http://hdl.handle.net/1721.1/34968,"Under an adaptive chosen ciphertext attack (CCA2), the security of an encryption scheme must hold against  adversaries that have access to a decryption oracle.   We consider a weakening of CCA2 security, wherein security need only hold against  adversaries making an a-priori bounded number of queries to the decryption oracle. Concerning this notion, which we call bounded-CCA2 security, we show the following two results.  (1) Bounded-CCA2 secure non-malleable encryption schemes exist if and only if semantically-secure (IND-CPA-secure) encryption schemes exist.(As far as we know, bounded-CCA2 non-malleability is the strongest notion of security known to be satisfiable assuming only the existence of semantically-secure encryption schemes.)  (2) In contrast to CCA2 security, bounded-CCA2 security alone does not imply non-malleability.  In particular, if there exists an encryption scheme that is bounded-CCA2 secure, then there exists another encryption scheme which remains   bounded-CCA2 secure, but is malleable under a simple chosen-plaintext attack.",17 p.; 1222225 bytes; 239045 bytes,application/postscript; application/pdf,en_US,Massachusetts Institute of Technology Computer Science and Artificial Intelligence Laboratory,Public-key Encryption; Non-Malleability; Chosen Ciphertext Security,Bounded CCA2-Secure Non-Malleable Encryption,,,,,,,,
Hal Abelson,"Abelson, Hal; Beal, Jacob; Sussman, Gerald Jay",Mathematics and Computation,2007-06-01T18:01:47Z,2007-06-01T18:01:47Z,2007,MIT-CSAIL-TR-2007-030,http://hdl.handle.net/1721.1/37591,"The goal of amorphous computing is to identify organizationalprinciples and create programming technologies for obtainingintentional, pre-specified behavior from the cooperation of myriadunreliable parts that are arranged in unknown, irregular, andtime-varying ways.  The heightened relevance of amorphous computingtoday stems from the emergence of new technologies that could serve assubstrates for information processing systems of immense power atunprecedentedly low cost, if only we could master the challenge ofprogramming them.  This document is a review of amorphous computing.",33 p.,,,Massachusetts Institute of Technology Computer Science and Artificial Intelligence Laboratory,,Amorphous Computing,preprint of article for Springer-Verlag Encyclopedia of Complexity and System Science,,,,,,,
Gerald Jay Sussman,"Bachrach, Jonathan; Beal, Jacob",Mathematics and Computation,2009-06-25T21:30:10Z,2009-06-25T21:30:10Z,2007,,http://hdl.handle.net/1721.1/45652,"Many programming domains involve the manipulation of values distributed through a manifold - examples include sensor networks, smart materials, and biofilms. This paper describes a programming semantics for manifolds based on the amorphous medium abstraction, which places a computational device at every point in the manifold. This abstraction enables the creation of programs that automatically scale to networks of different size and device density. This semantics is currently implemented in our language Proto and compiles for execution on Mica2 Motes and several other platforms.",15 p.,,,MIT-CSAIL-TR-2009-032,amorphous computing; spatial computing,Programming Manifolds,"Updated version; original published in Computing Media and Languages for Space-Oriented Computation, Dagstuhl Seminar 06361, September 2006",Creative Commons Attribution-No Derivative Works 3.0 Unported,http://creativecommons.org/licenses/by-nd/3.0/,,,,,
Silvio Micali,"Micali, Silvio; Valiant, Paul",Theory of Computation,2008-06-30T13:00:26Z,2008-06-30T13:00:26Z,2007- 11-02,MIT-CSAIL-TR-2008-039,http://hdl.handle.net/1721.1/41872,"Little is known about generating revenue in UNRESTRICTED combinatorial auctions. (In particular, the VCG mechanism has no revenue guarantees.) In this paper we determine how much revenue can be guaranteed in such auctions. Our analysis holds both in the standard model, when all players are independent and rational, as well as in a most adversarial model, where some players may bid collusively or even totally irrationally.",30 p.,,,,Revenue Benchmarks; Revenue lowerbounds; revenue upperbounds; Probabilistic DST mechanisms,Revenue in Truly Combinatorial Auctions and Adversarial Mechanism Design,,,,Massachusetts Institute of Technology Computer Science and Artificial Intelligence Laboratory; ,,,,
Martin Rinard,"Kuncak, Viktor",Computer Architecture,2007-01-02T20:21:50Z,2007-01-02T20:21:50Z,2007-01-01,MIT-CSAIL-TR-2007-001,http://hdl.handle.net/1721.1/35258,"Boolean Algebra with Presburger Arithmetic (BAPA) combines1) Boolean algebras of sets of uninterpreted elements (BA)and 2) Presburger arithmetic operations (PA).  BAPA canexpress the relationship between integer variables andcardinalities of unbounded finite sets and can be used toexpress verification conditions in verification of datastructure consistency properties.In this report I consider the Quantifier-Free fragment ofBoolean Algebra with Presburger Arithmetic (QFBAPA).Previous algorithms for QFBAPA had non-deterministicexponential time complexity.  In this report I show thatQFBAPA is in NP, and is therefore NP-complete.  My resultyields an algorithm for checking satisfiability of QFBAPAformulas by converting them to polynomially sized formulasof quantifier-free Presburger arithmetic.  I expect thisalgorithm to substantially extend the range of QFBAPAproblems whose satisfiability can be checked in practice.",14 p.; 315999 bytes; 842090 bytes,application/pdf; application/postscript,en_US,Massachusetts Institute of Technology Computer Science and Artificial Intelligence Laboratory,Caratheodory theorem; integer linear programming; integer cone; Hilbert basis,Quantifier-Free Boolean Algebra with Presburger Arithmetic is NP-Complete,,,,,,,,
Trevor Darrell,"Morency, Louis-Philippe; Quattoni, Ariadna; Darrell, Trevor",Vision,2007-01-08T01:16:48Z,2007-01-08T01:16:48Z,2007-01-07,MIT-CSAIL-TR-2007-002,http://hdl.handle.net/1721.1/35276,"Many problems in vision involve the prediction of a class label for each frame in an unsegmented sequence. In this paper we develop a discriminative framework for simultaneous sequence segmentation and labeling which can capture both intrinsic and extrinsic class dynamics. Our approach incorporates hidden state variables which model the sub-structure of a class sequence and learn the dynamics between class labels. Each class label has a disjoint set of associated hidden states, which enables efficient training and inference in our model. We evaluated our method on the task of recognizing human gestures from unsegmented video streams and performed experiments on three different datasets of head and eye gestures. Our results demonstrate that our model for visual gesture recognition outperform models based on Support Vector Machines, Hidden Markov Models, and Conditional Random Fields.",8 p.; 366380 bytes; 946243 bytes,application/pdf; application/postscript,en_US,Massachusetts Institute of Technology Computer Science and Artificial Intelligence Laboratory,,Latent-Dynamic Discriminative Models for Continuous Gesture Recognition,,,,,,,,
Krste Asanovic,"Batten, Christopher; Krashinsky, Ronny; Asanovic, Krste",Computer Architecture,2007-01-12T19:51:55Z,2007-01-12T19:51:55Z,2007-01-12,MIT-CSAIL-TR-2007-003,http://hdl.handle.net/1721.1/35724,"We are investigating vector-thread architectures which provide competitive performance and efficiency across a broad class of application domains. Vector-thread architectures unify data-level, thread-level, and instruction-level parallelism, providing new ways of parallelizing codes that are difficult to vectorize or that incur excessive synchronization costs when multithreaded. To illustrate these ideas we have developed the Scale processor, which is an example of a vector-thread architecture designed for low-power and high-performance embedded systems. The prototype includes a single-issue 32-bit RISC control processor, a vector-thread unit which supports up to 128 virtual processor threads and can execute up to 16 instructions per cycle, and a 32 KB shared primary cache.Since the Scale Vector-Thread Processor is a large and complex design (especially for an academic project), we first designed and fabricated the Scale Test Chip (STC1). STC1 includes a simplified version of the Scale control processor, 8 KB of RAM, a host interface, and a custom clock generator.  STC1 helped mitigate the risk involved in fabricating the full Scale chip in several ways. First, we were able to establish and test our CAD toolflow. Our toolflow included several custom tools which had not previously been used in any tapeouts. Second, we were able to better characterize our target package and process. For example, STC1 enabled us to better correlate the static timing numbers from our CAD tools with actual silicon and also to characterize the expected rise/fall times of our external signal pins. Finally, STC1 allowed us to test our custom clock generator. We used our experiences with STC1 to help us implement the Scale vector-thread processor. Scale was taped out on October 15, 2006 and it is currently being fabricated through MOSIS. This report discusses the fabrication of STC1 and presents power and performance results.",10 p.; 2613150 bytes; 4101404 bytes,application/postscript; application/pdf,en_US,Massachusetts Institute of Technology Computer Science and Artificial Intelligence Laboratory,,Scale Control Processor Test-Chip,,,,,,,,
Rodney Brooks,"Edsinger, Aaron",Humanoid Robotics,2007-01-17T02:59:49Z,2007-01-17T02:59:49Z,2007-01-16,MIT-CSAIL-TR-2007-004,http://hdl.handle.net/1721.1/35727,"Human environments present special challenges for robot manipulation. They are often dynamic, difficult to predict, and beyond the control of a robot engineer. Fortunately, many characteristics of these settings can be used to a robot's advantage. Human environments are typically populated by people, and a robot can rely on the guidance and assistance of a human collaborator. Everyday objects exhibit common, task-relevant features that reduce the cognitive load required for the object's use. Many tasks can be achieved through the detection and control of these sparse perceptual features. And finally, a robot is more than a passive observer of the world. It can use its body to reduce its perceptual uncertainty about the world.In this thesis we present advances in robot manipulation that address the unique challenges of human environments. We describe the design of a humanoid robot named Domo, develop methods that allow Domo to assist a person in everyday tasks, and discuss general strategies for building robots that work alongside people in their homes and workplaces.",228 p.; 772900059 bytes; 30793533 bytes,application/postscript; application/pdf,en_US,Massachusetts Institute of Technology Computer Science and Artificial Intelligence Laboratory,embodied intelligence; behavior-based,Robot Manipulation in Human Environments,,,,,PhD thesis,,,
Tommi Jaakkola,"Monteleoni, Claire; Kaariainen, Matti",Tommi's Machine Learning,2007-01-24T12:56:52Z,2007-01-24T12:56:52Z,2007-01-23,MIT-CSAIL-TR-2007-005,http://hdl.handle.net/1721.1/35784,"We compare the practical performance of several recently proposed algorithms for active learning in the online setting.  We consider two algorithms (and their combined variants) that are strongly online, in that they do not store any previously labeled examples, and for which formal guarantees have recently been proven under various assumptions.  We perform an empirical evaluation on optical character recognition (OCR) data, an application that we argue to be appropriately served by online active learning.  We compare the performance between the algorithm variants and show significant reductions in label-complexity over random sampling.",9 p.; 2188813 bytes; 767442 bytes,application/postscript; application/pdf,en_US,Massachusetts Institute of Technology Computer Science and Artificial Intelligence Laboratory,online learning; active learning; selective sampling; optical character recognition; OCR,Online Active Learning in Practice,,,,,,,,
Rodney Brooks,"Kumpf, Adam",Humanoid Robotics,2007-01-31T12:27:15Z,2007-01-31T12:27:15Z,2007-01-30,MIT-CSAIL-TR-2007-006,http://hdl.handle.net/1721.1/35821,"This thesis presents the findings of exploratory research in low-cost compliant robotics.  The most heavily leveraged trade-off is that of mechanical precision for computational power, with the hope that the price of future computation will continue to fall exponentially while the expected price of precision mechanical parts will remain relatively constant.  The most novel contribution of this research is the Torsionally Compliant Elastomer Joint (TCEJ) which allows for compliance and sensing in a very small package while using extremely inexpensive components.  Computational modeling of hysteresis, signal compression, and backlash are also explored to compensate for the non-idealities often found in cheap mechanical parts.  Three proof-of-concept systems are described along with a set of experiments used to test their capabilities.  Finally, future work is proposed that will likely shape the next generation of low-cost compliant robotics.",99 p.; 89615040 bytes; 4874283 bytes; 2654023 bytes,application/postscript; video/quicktime; application/pdf,en_US,Massachusetts Institute of Technology Computer Science and Artificial Intelligence Laboratory,,Explorations in Low-Cost Compliant Robotics,,,,,MEng thesis,,,
Peter Szolovits,"McGeachie, Michael",Clinical Decision-Making,2007-06-01T11:41:48Z,2007-06-01T11:41:48Z,2007-02-01,MIT-CSAIL-TR-2007-029,http://hdl.handle.net/1721.1/37590,"Existing preference reasoning systems have been successful insimple domains. Broader success requires more natural and moreexpressive preference representations.  This thesis develops arepresentation of logical preferences that combines numericaltradeoff ratios between partial outcome descriptions withqualitative preference information. We argue our system is uniqueamong preference reasoning systems; previous work has focused onqualitative or quantitative preferences, tradeoffs, exceptions andgeneralizations, or utility independence, but none have combinedall of these expressions under a unified methodology.We present new techniques for representing and giving meaning toquantitative tradeoff statements between different outcomes.  Thetradeoffs we consider can be multi-attribute tradeoffs relatingmore than one attribute at a time, they can refer to discrete orcontinuous domains, be conditional or unconditional, andquantified or qualitative.  We present related methods ofrepresenting judgments of attribute importance.  We then buildupon a methodology for representing arbitrary qualitative ceteris paribuspreference, or preferences ``other things being equal,"" aspresented in MD04.  Tradeoff preferences inour representation are interpreted as constraints on the partialderivatives of the utility function. For example, a decision makercould state that ``Color is five times as important as price,availability, and time,"" a sentiment one might express in thecontext of repainting a home, and this is interpreted asindicating that utility increases in the positive color directionfive times faster than utility increases in the positive pricedirection.  We show that these representations generalize both theeconomic notion of marginal rates of substitution and previousrepresentations of preferences in AI.",129 p.,,,Massachusetts Institute of Technology Computer Science and Artificial Intelligence Laboratory,Decision Making; Preference Reasoning; Utility Functions,Local Geometry of Multiattribute Tradeoff Preferences,"McGeachie, Michael.  PhD Thesis, MIT, 2007.",,,,PhD thesis,,,
Tomaso Poggio,"Rifkin, Ryan; Bouvrie, Jake; Schutte, Ken; Chikkerur, Sharat; Kouh, Minjoon; Ezzat, Tony; Poggio, Tomaso",Center for Biological and Computational Learning (CBCL),2007-02-01T18:26:47Z,2007-02-01T18:26:47Z,2007-02-01,MIT-CSAIL-TR-2007-007; CBCL-266,http://hdl.handle.net/1721.1/35835,"A preliminary set of experiments are described in which a biologically-inspired computer vision system (Serre, Wolf et al. 2005; Serre 2006; Serre, Oliva et al. 2006; Serre, Wolf et al. 2006) designed for visual object recognition was applied to the task of phonetic classification. During learning, the systemprocessed 2-D wideband magnitude spectrograms directly as images, producing a set of 2-D spectrotemporal patch dictionaries at different spectro-temporal positions, orientations, scales, and of varying complexity. During testing, features were computed by comparing the stored patches with patches fromnovel spectrograms. Classification was performed using a regularized least squares classifier (Rifkin, Yeo et al. 2003; Rifkin, Schutte et al. 2007) trained on the features computed by the system. On a 20-class TIMIT vowel classification task, the model features achieved a best result of 58.74% error, compared to 48.57% error using state-of-the-art MFCC-based features trained using the same classifier. This suggests that hierarchical, feed-forward, spectro-temporal patch-based architectures may be useful for phoneticanalysis.",16 p.; 2265616 bytes; 383591 bytes,application/postscript; application/pdf,en_US,Massachusetts Institute of Technology Computer Science and Artificial Intelligence Laboratory,phonetic classification; hierarchical models; regularized least-squares; spectrotemporal patches,"Phonetic Classification Using Hierarchical, Feed-forward, Spectro-temporal Patch-based Architectures",,,,,,http://hdl.handle.net/1721.1/36865,http://hdl.handle.net/1721.1/36865,
Hari Balakrishnan,"Jamieson, Kyle; Balakrishnan, Hari",Networks & Mobile Systems,2007-02-13T06:19:09Z,2007-02-13T06:19:09Z,2007-02-02,MIT-CSAIL-TR-2007-008,http://hdl.handle.net/1721.1/35889,"Bit errors occur over wireless channels when the signal isn't strongenough to overcome the effects of interference and noise.  Currentwireless protocols may use forward error correction (FEC) to correct forsome (small) number of bit errors, but generally retransmit the wholepacket if the FEC is insufficient.  We observe that current wirelessmesh network protocols retransmit a number of packets and that most ofthese retransmissions end up sending bits that have already beenreceived multiple times, wasting network capacity.  To overcome thisinefficiency, we develop, implement, and evaluate a partial packetrecovery (PPR) system.PPR incorporates three new ideas: (1) SoftPHY, an expandedphysical layer (PHY) interface to provide hints to the higher layersabout how ``close'' the actual received symbol was to the one decoded,(2) a postamble scheme to recover data even when a packet'spreamble is corrupted and not decodable at the receiver, and (3) PP-ARQ, an asynchronous link-layer retransmission protocol that allowsa receiver to compactly encode and request for retransmission only thoseportions of a packet that are likely in error.Our experimental results from a 27-node 802.15.4 testbed that includesTelos motes with 2.4 GHz Chipcon radios and GNU Radio nodes implementingthe Zigbee standard (802.15.4) show that PPR increases the framedelivery rate by a factor of 2x under moderate load, and7x under heavy load when many links have marginal quality.",27 p.,,,Massachusetts Institute of Technology Computer Science and Artificial Intelligence Laboratory,802.11; wireless networks,PPR: Partial Packet Recovery for Wireless Networks,,,,,,,,
Barbara Liskov,"Cowling, James; Myers, Daniel; Liskov, Barbara; Rodrigues, Rodrigo; Shrira, Liuba",Programming Methodology,2007-02-13T06:17:18Z,2007-02-13T06:17:18Z,2007-02-12,MIT-CSAIL-TR-2007-009,http://hdl.handle.net/1721.1/35888,"There are currently two approaches to providing Byzantine-fault-tolerant state machine replication: a replica-based approach, e.g., BFT, that uses communication between replicas to agree on a proposed ordering of requests, and a quorum-based approach, such as Q/U, in which clients contact replicas directly to optimistically execute operations. Both approaches have shortcomings: the quadratic cost of inter-replica communication is unnecessary when there is no contention, and Q/U requires a large number of replicas and performs poorly under contention.We present HQ, a hybrid Byzantine-fault-tolerant state machine replication protocol that overcomes these problems. HQ employs a lightweight quorum-based protocol when there is no contention, but  uses BFT to resolve contention when it arises.  Furthermore, HQ uses only 3f+1 replicas to tolerate f faults, providing optimal resilience to node failures.We implemented a prototype of HQ, and we compare its performance to BFT and Q/U analytically and experimentally. Additionally, in this work we use a new implementation of BFT designed to scale as the number of faults increases.  Our results show that both HQ and our new implementation of BFT scale as f increases; additionally our hybrid approach of using BFT to handle contention works well.",18 p.,,,Massachusetts Institute of Technology Computer Science and Artificial Intelligence Laboratory,,HQ Replication: Properties and Optimizations,,,,,,,,
Leslie Kaelbling,"Marthi, Bhaskara",Learning and Intelligent Systems,2007-02-13T19:01:57Z,2007-02-13T19:01:57Z,2007-02-13,MIT-CSAIL-TR-2007-010,http://hdl.handle.net/1721.1/35890,"This paper investigates the problem of automatically learning how torestructure the reward function of a Markov decision process so as tospeed up reinforcement learning.  We begin by describing a method thatlearns a shaped reward function given a set of state and temporalabstractions.  Next, we consider decomposition of the per-timestepreward in multieffector problems, in which the overall agent can bedecomposed into multiple units that are concurrently carrying outvarious tasks.  We show by example that to find a good rewarddecomposition, it is often necessary to first shape the rewardsappropriately.  We then give a function approximation algorithm forsolving both problems together.  Standard reinforcement learningalgorithms can be augmented with our methods, and we showexperimentally that in each case, significantly faster learningresults.",8 p.,,,Massachusetts Institute of Technology Computer Science and Artificial Intelligence Laboratory,,Automatic shaping and decomposition of reward functions,,,,,,,,
