dc.contributor.author,dc.contributor.other,dc.date.accessioned,dc.date.available,dc.date.issued,dc.identifier.other,dc.identifier.uri,dc.description.abstract,dc.format.extent,dc.format.mimetype,dc.language.iso,dc.relation.ispartofseries,dc.title,dc.subject,dc.contributor.advisor,dc.description,dc.identifier.citation
"Tan, Godfrey; Guttag, John",Networks and Mobile Systems,2005-12-22T02:15:36Z,2005-12-22T02:15:36Z,2004-11-12,MIT-CSAIL-TR-2004-073; MIT-LCS-TR-973,http://hdl.handle.net/1721.1/30503,"Today's access point based wireless LANs (WLANs) are inefficient and unfair. For many traffic loads they provide far less total throughput than they should, and do a poor job allocating what throughput they do deliver. Inappropriate association of nodes to access points and rates to flows plays a large role in these problems. We address a major root cause of this problem in this paper.Current practice ignores the distinction between flows that connect two wireless nodes via an access point and flows that connect wireless nodes to the wired infrastructure. As wireless devices and applications become more pervasive, ignoring this distinction will lead to a significant degradation in perceived performance.In this paper, we i) describe a series of examples that illustrates the impact of two-hop flows on the performance of the system, ii) provide a practical algorithm to solve the AP-assignment problem and iii) evaluate the performance of our algorithm against other approaches. Our preliminary results show that our algorithm can increase average achieved throughput by as much as 50% for some traffic loads.",17 p.; 20308180 bytes; 807306 bytes,application/postscript; application/pdf,en_US,Massachusetts Institute of Technology Computer Science and Artificial Intelligence Laboratory,Capacity Allocation in Wireless LANs,,,,
"Cadieu, Charles; Kouh, Minjoon; Riesenhuber, Maximilian; Poggio, Tomaso",,2005-12-22T02:15:22Z,2005-12-22T02:15:22Z,2004-11-12,MIT-CSAIL-TR-2004-071; AIM-2004-024; CBCL-241,http://hdl.handle.net/1721.1/30501,"The computational processes in the intermediate stages of the ventral pathway responsible for visual object recognition are not well understood. A recent physiological study by A. Pasupathy and C. Connor in intermediate area V4 using contour stimuli, proposes that a population of V4 neurons display bjectcentered,position-specific curvature tuning [18]. The standard model of object recognition, a recently developed model [23] to account for recognition properties of IT cells (extending classical suggestions by Hubel, Wiesel and others [9, 10, 19]), is used here to model the response of the V4 cells described in [18]. Our results show that a feedforward, network level mechanism can exhibit selectivity and invariance properties that correspond to the responses of the V4 cells described in [18]. These results suggest howobject-centered, position-specific curvature tuning of V4 cells may arise from combinations of complex V1 cell responses. Furthermore, the model makes predictions about the responses of the same V4 cells studied by Pasupathy and Connor to novel gray level patterns, such as gratings and natural images. Thesepredictions suggest specific experiments to further explore shape representation in V4.",12 p.; 38801213 bytes; 5292186 bytes,application/postscript; application/pdf,en_US,Massachusetts Institute of Technology Computer Science and Artificial Intelligence Laboratory,Shape Representation in V4: Investigating Position-Specific Tuning for Boundary Conformation with the Standard Model of Object Recognition,AI; V4 Visual Cortex Object Recognition Standard Model,,,
"Wolf, Lior; Martin, Ian",,2005-12-22T02:15:29Z,2005-12-22T02:15:29Z,2004-11-12,MIT-CSAIL-TR-2004-072; AIM-2004-025; CBCL-242,http://hdl.handle.net/1721.1/30502,"In this paper, we present and analyze a novel regularization technique based on enhancing our dataset with corrupted copies of the original data. The motivation is that since the learning algorithm lacks information about which parts of thedata are reliable, it has to produce more robust classification functions. We then demonstrate how this regularization leads to redundancy in the resulting  classifiers, which is somewhat in contrast to the common interpretations of the Occams razor principle. Using this framework, we propose a simple addition to the gentle boosting algorithm which enables it to work with only a few examples. We test this new algorithm on a variety of datasets and show convincing results.",0 p.; 16224097 bytes; 656543 bytes,application/postscript; application/pdf,en_US,Massachusetts Institute of Technology Computer Science and Artificial Intelligence Laboratory,Regularization Through Feature Knock Out,AI,,,
"Serre, Thomas; Wolf, Lior; Poggio, Tomaso",,2005-12-22T02:15:45Z,2005-12-22T02:15:45Z,2004-11-14,MIT-CSAIL-TR-2004-074; AIM-2004-026; CBCL-243,http://hdl.handle.net/1721.1/30504,"In this paper, we introduce a novel set of features for robust object recognition, which exhibits outstanding performances on a variety ofobject categories while being capable of learning from only a fewtraining examples. Each element of this set is a complex featureobtained by combining position- and scale-tolerant edge-detectors overneighboring positions and multiple orientations.Our system - motivated by a quantitative model of visual cortex -outperforms state-of-the-art systems on a variety of object imagedatasets from different groups. We also show that our system is ableto learn from very few examples with no prior category knowledge.  Thesuccess of the approach is also a suggestive plausibility proof for aclass of feed-forward models of object recognition in cortex. Finally,we conjecture the existence of a universal overcompletedictionary of features that could handle the recognition of all objectcategories.",10 p.; 17638397 bytes; 793841 bytes,application/postscript; application/pdf,en_US,Massachusetts Institute of Technology Computer Science and Artificial Intelligence Laboratory,A new biologically motivated framework for robust object recognition,AI; visual cortex; object recognition; face detection; hierarchy; feature learning,,,
"Balazinska, Magdalena; Balakrishnan, Hari; Madden, Samuel; Stonebraker, Mike",Networks and Mobile Systems,2005-12-22T02:16:16Z,2005-12-22T02:16:16Z,2004-11-22,MIT-CSAIL-TR-2004-077; MIT-LCS-TR-974,http://hdl.handle.net/1721.1/30506,"processing. In contrast to previous techniques that handlenode failures, our approach also tolerates network failuresand network partitions. The approach is based on a principledtrade-off between consistency and availability in theface of failure, that (1) ensures that all data on an inputstream is processed within a specified time threshold, but(2) reduces the impact of failures by limiting if possible thenumber of results produced based on partially available inputdata, and (3) corrects these results when failures heal.Our approach is well-suited for applications such as environmentmonitoring, where high availability and real-timeresponse is preferable to perfect answers.Our approach uses replication and guarantees that all processingreplicas achieve state consistency, both in the absenceof failures and after a failure heals. We achieve consistencyin the former case by defining a data-serializing operatorthat ensures that the order of tuples to a downstreamoperator is the same at all the replicas. To achieve consistencyafter a failure heals, we develop approaches based oncheckpoint/redo and undo/redo techniques.We have implemented these schemes in a prototype distributedstream processing system, and present experimentalresults that show that the system meets the desiredavailability-consistency trade-offs.",12 p.; 25764097 bytes; 1231086 bytes,application/postscript; application/pdf,en_US,Massachusetts Institute of Technology Computer Science and Artificial Intelligence Laboratory,Availability-Consistency Trade-Offs in a Fault-Tolerant Stream Processing System,,,,
"Srebro, Nathan",,2005-12-22T02:16:24Z,2005-12-22T02:16:24Z,2004-11-22,MIT-CSAIL-TR-2004-076; AITR-2004-009,http://hdl.handle.net/1721.1/30507,"Matrices that can be factored into a product of two simpler matricescan serve as a useful and often natural model in the analysis oftabulated or high-dimensional data.  Models based on matrixfactorization (Factor Analysis, PCA) have been extensively used instatistical analysis and machine learning for over a century, withmany new formulations and models suggested in recent years (LatentSemantic Indexing, Aspect Models, Probabilistic PCA, Exponential PCA,Non-Negative Matrix Factorization and others).  In this thesis weaddress several issues related to learning with matrix factorizations:we study the asymptotic behavior and generalization ability ofexisting methods, suggest new optimization methods, and present anovel maximum-margin high-dimensional matrix factorizationformulation.",132 p.; 96239481 bytes; 5561927 bytes,application/postscript; application/pdf,en_US,Massachusetts Institute of Technology Computer Science and Artificial Intelligence Laboratory,Learning with Matrix Factorizations,AI,,,
"Grauman, Kristen; Darrell, Trevor",,2005-12-22T02:16:07Z,2005-12-22T02:16:07Z,2004-11-22,MIT-CSAIL-TR-2004-075; AIM-2004-027,http://hdl.handle.net/1721.1/30505,"Sets of local features that are invariant to common image transformations are an effective representation to use when comparing images; current methods typically judge feature sets' similarity via a voting scheme (which ignores co-occurrence statistics) or by comparing histograms over a set of prototypes (which must be found by clustering).  We present a method for efficiently comparing images based on their discrete distributions (bags) of distinctive local invariant features, without clustering descriptors.  Similarity between images is measured with an approximation of the Earth Mover's Distance (EMD), which quickly computes the minimal-cost correspondence between two bags of features.  Each image's feature distribution is mapped into a normed space with a low-distortion embedding of EMD.  Examples most similar to a novel query image are retrieved in time sublinear in the number of examples via approximate nearest neighbor search in the embedded space.  We also show how the feature representation may be extended to encode the distribution of geometric constraints between the invariant features appearing in each image.We evaluate our technique with scene recognition and texture classification tasks.",18 p.; 78764149 bytes; 16484168 bytes,application/postscript; application/pdf,en_US,Massachusetts Institute of Technology Computer Science and Artificial Intelligence Laboratory,Efficient Image Matching with Distributions of Local Invariant Features,AI; image matching; object recognition; content-based image retrieval; texture,,,
"Harvey, Nicholas J.; Kleinberg, Robert D.; Lehman, April Rasala",,2005-12-22T02:16:27Z,2005-12-22T02:16:27Z,2004-11-24,MIT-CSAIL-TR-2004-078; MIT-LCS-TR-964,http://hdl.handle.net/1721.1/30508,"Given a graph G = (V,E) and k source-sink pairs of vertices, this papers investigates the maximum rate r at which all pairs can simultaneously communicate. We view this problem from two perspectives and compare their advantages. In the multicommodity flow formulation, a solution provides dedicated bandwidth r between each source-sink pair. In the information flow formulation, a vertex can transmit a function of the information it received thereby allowing multiple source-sink pairs to share bandwidth. For directed acyclic graphs with n vertices, we show that the rate achievable in the information flow formulation can be a multiplicative factor n larger than the rate achievable in the multicommodity flow formulation. It is well known [5] that for undirected graphs with n vertices, in the multicommodity flow formulation, the maximum rate achievable can be an O(1/log|V|) multiplicative factor smaller than the value of the sparsest cut. We extend this result to show that the maximum rate achievable in the information flow setting can be an O(1/log|V|) multiplicative factor smaller than the sparsest cut value.For directed acyclic graphs G, we define a parameter called the value of the most meager cut which is an upper bound for the maximum rate achievable in the information flow setting.We also present an example illustrating that this upper bound is not always tight.",13 p.; 14089646 bytes; 597139 bytes,application/postscript; application/pdf,en_US,Massachusetts Institute of Technology Computer Science and Artificial Intelligence Laboratory,Comparing Network Coding with Multicommodity Flow for the k-pairs Communication Problem,,,,
"Kuncak, Viktor; Rinard, Martin",Computer Architecture,2005-12-22T02:19:36Z,2005-12-22T02:19:36Z,2004-11-30,MIT-CSAIL-TR-2004-079; MIT-LCS-TR-975,http://hdl.handle.net/1721.1/30509,"An important feature of object-oriented programming languages is the ability todynamically instantiate user-defined container data structures such as lists, trees,and hash tables. Programs implement such data structures using references todynamically allocated objects, which allows data structures to store unboundednumbers of objects, but makes reasoning about programs more difficult. Reasoningabout object-oriented programs with complex data structures is simplified if datastructure operations are specified in terms of abstract sets of objects associatedwith each data structure. For example, an insertion into a data structure in thisapproach becomes simply an insertion into a dynamically changing set-valued fieldof an object, as opposed to a manipulation of a dynamically linked structure linkedto the object.In this paper we explore reasoning techniques for programs that manipulate datastructures specified using set-valued abstract fields associated with container objects.We compare the expressive power and the complexity of specification languagesbased on 1) decidable prefix vocabulary classes of first-order logic, 2) twovariablelogic with counting, and 3) Nelson-Oppen combinations of multisortedtheories. Such specification logics can be used for verification of object-orientedprograms with supplied invariants. Moreover, by selecting an appropriate subsetof properties expressible in such logic, the decision procedures for these logics yieldautomated computation of lattice operations in abstract interpretation domain, aswell as automated computation of abstract program semantics.",16 p.; 19825924 bytes; 756829 bytes,application/postscript; application/pdf,en_US,Massachusetts Institute of Technology Computer Science and Artificial Intelligence Laboratory,On Decision Procedures for Set-Value Fields,,,,
"Salcianu, Alexandru; Arkoudas, Konstantine",Program Analysis,2005-12-22T02:19:45Z,2005-12-22T02:19:45Z,2004-12-16,MIT-CSAIL-TR-2004-080; MIT-LCS-TR-976,http://hdl.handle.net/1721.1/30510,"This technical report describes our experience using the interactive theorem proverAthena for proving the correctness of abstract interpretation-based dataflow analyses.For each analysis, our methodology requires the analysis designer to formallyspecify the property lattice, the transfer functions, and the desired modeling relationbetween the concrete program states and the results computed by the analysis. Thegoal of the correctness proof is to prove that the desired modeling relation holds.The proof allows the analysis clients to rely on the modeling relation for their owncorrectness. To reduce the complexity of the proofs, we separate the proof of eachdataflow analysis into two parts: a generic part, proven once, independent of anyspecific analysis; and several analysis-specific conditions proven in Athena.",16 p.; 18540541 bytes; 798716 bytes,application/postscript; application/pdf,en_US,Massachusetts Institute of Technology Computer Science and Artificial Intelligence Laboratory,Machine-Checkable Correctness Proofs forIntra-procedural Dataflow Analyses,,,,
"Liang, Percy; Srebro, Nathan",,2005-12-22T02:19:52Z,2005-12-22T02:19:52Z,2004-12-30,MIT-CSAIL-TR-2004-081; AIM-2004-030,http://hdl.handle.net/1721.1/30511,"Markov trees generalize naturally to bounded tree-width Markov networks, onwhich exact computations can still be done efficiently.  However, learning themaximum likelihood Markov network with tree-width greater than 1 is NP-hard, sowe discuss a few algorithms for approximating the optimal Markov network.  Wepresent a set of methods for training a density estimator.  Each method isspecified by three arguments: tree-width, model scoring metric (maximumlikelihood or minimum description length), and model representation (using onejoint distribution or several class-conditional distributions).  On thesemethods, we give empirical results on density estimation and classificationtasks and explore the implications of these arguments.",10 p.; 10714507 bytes; 473643 bytes,application/postscript; application/pdf,en_US,Massachusetts Institute of Technology Computer Science and Artificial Intelligence Laboratory,Methods and Experiments With Bounded Tree-width Markov Networks,AI; tree-width; hypertrees; Markov Networks; maximum likelihood; MDL,,,
"Kouh, Minjoon; Poggio, Tomaso",,2005-12-22T02:19:58Z,2005-12-22T02:19:58Z,2004-12-31,MIT-CSAIL-TR-2004-082; AIM-2004-031; CBCL-245,http://hdl.handle.net/1721.1/30512,Tuning to an optimal stimulus is a widespread property of neurons in cortex. We propose that such tuning is a consequence of normalization or gain control circuits. We also present a biologically plausible neural circuitry of tuning.,9 p.; 11464000 bytes; 738607 bytes,application/postscript; application/pdf,en_US,Massachusetts Institute of Technology Computer Science and Artificial Intelligence Laboratory,A general mechanism for tuning: Gain control circuits and synapses underlie tuning of cortical neurons,AI; tuning; gain control; normalization; Gaussian; neuron; cortex; biophysics,,,
"Richards, Whitman; Seung, H. Sebastian",,2005-12-22T02:20:05Z,2005-12-22T02:20:05Z,2004-12-31,MIT-CSAIL-TR-2004-083; AIM-2004-029,http://hdl.handle.net/1721.1/30513,"Winner-take-all networks typically pick as winners that alternative with the largest excitatory input. This choice is far from optimal when there is uncertainty in the strength of the inputs, and when information is available about how alternatives may be related. In the Social Choice community, many other procedures will yield more robust winners. The Borda Count and the pair-wise Condorcet tally are among the most favored. Their implementations are simple modifications of classical recurrent networks.",12 p.; 13714512 bytes; 523751 bytes,application/postscript; application/pdf,en_US,Massachusetts Institute of Technology Computer Science and Artificial Intelligence Laboratory,Neural Voting Machines,AI; WTA; Borda machine; Condorcet procedure; neural network,,,
"Radul, Alexey",Mathematics and Computation,2006-04-14T15:26:55Z,2006-04-14T15:26:55Z,2005,MIT-CSAIL-TR-2006-024,http://hdl.handle.net/1721.1/32531,"I devised and implemented a method for constructing regular andsemiregular geometric objects in n-dimensional Euclidean space.Given a finite reflection group (a Coxeter group) G, there is a standard way to give G a group action on n-space.Reflecting a point through this group action yieldsan object that exhibits the symmetries specified by G.  If the pointis chosen well, the object is guaranteed to be regular or semiregular,and many interesting regular and semiregular objectsarise this way.  By starting with the symmetry group, I can use thegroup structure both to simplify the actual graphics involved withdisplaying the object, and to illustrate various aspects of itsstructure.  For example, subgroups of the symmetry group (and theircosets) correspond to substructures of the object.  Conversely, bydisplaying such symmetric objects and their various substructures, Ifind that I can elucidate the structure of the symmetry group thatgives rise to them.I have written The Symmetriad, the computer system whose name thisdocument has inherited, and used it to explore 3- and 4-dimensionalsymmetric objects and their symmetry groups.  The 3-dimensionalobjects are already well understood, but they serve to illustrate thetechniques used on the 4-dimensional objects and make them morecomprehensible.  Four dimensions offers a treasure trove of intriguingstructures, many of which have no ready 3D analogue.  These are what Iwill show you here.",111 p.; 1054739 bytes; 8185809 bytes,application/pdf; application/postscript,en_US,Massachusetts Institute of Technology Computer Science and Artificial Intelligence Laboratory,The Symmetriad: A Journey of Discovery Through the Land of the Polychora,,Gerald Sussman,MEng thesis,"Radul, Alexey.    The Symmetriad : a journey of discovery through the land of the polychora / by Alexey Radul.    c2005.Institute Archives - Noncirculating Collection 3 |  THESIS Thesis E.E. 2005 M.Eng"
"Izmalkov, Sergei; Lepinski, Matt; Micali, Silvio",Theory of Computation,2007-07-30T16:01:48Z,2007-07-30T16:01:48Z,2005,MIT-CSAIL-TR-2007-040,http://hdl.handle.net/1721.1/38208,"Privacy and trust affect our strategic thinking, yet they have not been precisely modeled in mechanism design. In settings of incomplete information,  traditional implementations of a normal-form mechanism ---by disregarding the players' privacy, or assuming trust in a mediator--- may not be realistic and fail to reach the mechanism's objectives. We thus investigate implementations of a new type.We put forward the notion of a  perfect implementation of a normal-form mechanism M: in essence, an extensive-form mechanism exactly preserving all strategic properties of M, without relying on a trusted  party or violating the privacy of the players.We prove that ANY normal-form mechanism  can be perfectly implemented via envelopes and an envelope-randomizing device (i.e., the same tools used for running fair lotteries or tallying secret votes).",51 p.,,,Massachusetts Institute of Technology Computer Science and Artificial Intelligence Laboratory,Perfect Implementation of Normal-Form Mechanisms,Mechanism Design; Privacy; Privacy Equivalence; Strategic Equivalence; Perfect Implementation,Silvio Micali,,Ealier Version in 46th Foundation of Computer Science Conference
"Liang, Percy; Srebro, Nati",Algorithms,2005-12-22T02:20:16Z,2005-12-22T02:20:16Z,2005-01-03,MIT-CSAIL-TR-2005-001; MIT-LCS-TR-977,http://hdl.handle.net/1721.1/30514,"We present a dynamic data structure that keeps track of an acyclic hypergraph (equivalently, a triangulated graph) and enables verifying that adding a candidate hyperedge (clique) will not break the acyclicity of the augmented hypergraph. This is a generalization of the use of Tarjan's Union-Find data structure for maintaining acyclicity when augmenting forests, and the amortized time per operation has a similar almost-constant dependence on the size of the hypergraph. Such a data structure is useful when augmenting acyclic hypergraphs, e.g.\~in order to greedily construct a high-weight acyclic hypergraph. In designing this data structure, we introduce a hierarchical decomposition of acyclic hypergraphs that aid in understanding {\em hyper-connectivity}, and introduce a novel concept of a {\em hypercycle} which is excluded from acyclic hypergraphs.",12 p.; 17306554 bytes; 656257 bytes,application/postscript; application/pdf,en_US,Massachusetts Institute of Technology Computer Science and Artificial Intelligence Laboratory,A Dynamic Data Structure for Checking Hyperacyclicity,,,,
"Liang, Percy; Srebro, Nati",Algorithms,2005-12-22T02:20:23Z,2005-12-22T02:20:23Z,2005-01-03,MIT-CSAIL-TR-2005-002; MIT-LCS-TR-978,http://hdl.handle.net/1721.1/30515,"Current approximation algorithms for maximum weight {\em hypertrees} find heavy {\em windmill farms}, and are based on the fact that a constant ratio (for constant width $k$) of the weight of a $k$-hypertree can be captured by a $k$-windmill farm. However, the exact worst case ratio is not known and is only bounded to be between $1/(k+1)!$ and $1/(k+1)$. We investigate this worst case ratio by searching for weighted hypertrees that minimize the ratio of their weight that can be captured with a windmill farm. To do so, we use a novel approach in which a linear program is used to find ``bad'' inputs to a dynamic program.",12 p.; 13845223 bytes; 531507 bytes,application/postscript; application/pdf,en_US,Massachusetts Institute of Technology Computer Science and Artificial Intelligence Laboratory,How Much of a Hypertree can be Captured by Windmills?,,,,
"Beal, Jacob; Sussman, Gerald",,2005-12-22T02:20:32Z,2005-12-22T02:20:32Z,2005-01-18,MIT-CSAIL-TR-2005-003; AIM-2005-001,http://hdl.handle.net/1721.1/30516,"Inspired by the robustness and flexibility of biological systems, we are developing linguistic and programming tools to allow us to program spatial systems populated by vast numbers of unreliable components interconnected in unknown, irregular, and time-varying ways. We organize our computations around geometry, making the fact that our system is made up of discrete individuals implicit. Geometry allows us to specify requirements in terms of the behavior of the space occupied by the aggregate rather than the behavior of individuals, thereby decreasing complexity. So we describe the behavior of space explicitly, abstracting away the discrete nature of the components. As an example, we present the Amorphous Medium Language, which describes behavior in terms of homeostatic maintenance of constraints on nested regions of space.",17 p.; 42144634 bytes; 6024067 bytes,application/postscript; application/pdf,en_US,Massachusetts Institute of Technology Computer Science and Artificial Intelligence Laboratory,Biologically-Inspired Robust Spatial Programming,AI; amorphous robust biological spatial sensor networks language programming medium,,,
